Description,Status,Type,Scale,Timetable
Act as a consultee for major planning applications in their area,Ongoing,Prevention,National,2021 to 2027
Act on recommendations within the Green Infrastructure Strategy and Climate Action Commission in Essex,Not started - agreed,Prevention,Flood Risk Area,2021 to 2027
Actively monitor the relationship between recorded water levels at South Quay and observed impacts of flooding in King's Lynn,Not started - proposed,Preparedness,Flood Risk Area,2021 to 2027
Adapt local planning policy to require betterment from brownfield sites in areas of sewer stress in Milton Keynes,Not started - proposed,Prevention,Flood Risk Area,2025
Administer government recovery/repair grants in Newbury and Thatcham,Ongoing,Recovery and Review,Flood Risk Area,2021 to 2027
"Agree an approach to monitor and manage any impacts of existing beaver populations on Environment Agency flood risk management activities  in Herefordshire
",Not started - proposed,Protection,Management Catchment,2021 to 2027
Agree an approach to monitor and manage any impacts of existing beaver populations on Environment Agency flood risk management activities in South West England,Ongoing,Other,River Basin District,2021 and 2027
Agree an approach to monitor and manage any impacts of existing beaver populations on Environment Agency flood risk management activities in the Environment Agency Wessex area,Not started - proposed,Protection,River Basin District,2021 to 2027
Aim to deliver priority actions on climate change adaptation and sustainability in Newcastle City Centre Flood Risk Area,Ongoing,Preparedness,Flood Risk Area,Between 2021 and 2027
Aim to develop Coastal Change Management Areas (CCMAs) in areas along the BCP Council coastline,Not started - proposed,Prevention,Management Catchment,2025
"Aim to establish a North West Coastal Centre of Excellence, sharing expertise, resources and innovative approaches for coastal schemes in northern England",Ongoing,Prevention,River Basin District,2021 to 2027
"Aim to establish a North West Coastal Centre of Excellence, sharing expertise, resources and innovative approaches for coastal schemes in the North West of England",Ongoing,Prevention,River Basin District,2021 to 2027
Aim to reduce flood risk in new developments by reviewing and improving the current lead local flood authority planning application review process in London Borough of Barnet,Not started - proposed,Prevention,Flood Risk Area,2027
Align flood defence asset data and information with the requirements of the Environment Agency's asset management system in the Broadland area,Not started - proposed,Protection,Management Catchment,2023
Align principles for modelling climate change and projected growth scenarios in northern England,Not started - proposed,Prevention,River Basin District,2023
Align principles for modelling climate change and projected growth scenarios in the North West of England,Not started - proposed,Prevention,River Basin District,2023
"Align their respective investment plans using the Cumbria Strategic Partnership, and a strategic coordinated approach in the Kent catchment",Not started - proposed,Prevention,Flood Risk Area,2021 to 2027
Apply a flood risk-based approach to maintenance planning programmes in Northamptonshire,Not started - proposed,Prevention,River Basin District,2027
Apply for further grants and work with partners to implement the recommendations of the Surface Water Management Plan in Thatcham,Ongoing,Protection,Flood Risk Area,2021 to 2024
Appraise flooding issues related to interconnected networks in the Waterfall Flood Risk Area,Not started - proposed,Protection,Flood Risk Area,2022
Assess and review the aims of the Alconbury partnership group so members have oversight and ownership of future studies and capital works in Alconbury,Not started - proposed,Preparedness,Flood Risk Area,2022
Assess and review the aims of the Alconbury partnership group so members have oversight and ownership of future studies and capital works in the Alconbury Brook catchment,Not started - proposed,Preparedness,Flood Risk Area,2022
Assess future flood risk in Huntingdon,Not started - proposed,Prevention,Flood Risk Area,2021 to 2027
Assess options to continue the delivery of the flood alleviation scheme in Chelmsford,Ongoing,Protection,Management Catchment,2021 to 2027
Assess options to install a CCTV camera in Oakington,Not started - proposed,Preparedness,Flood Risk Area,2024
Assess standard of service of existing defences along the frontage and investigate options available within current Shoreline Management Plan policy in Seasalter,Not started - proposed,Protection,Flood Risk Area,2021 to 2027
Assess the feasibility of installing natural sustainable urban drainage systems within council owned and managed open spaces within parks and estates in Lambeth Borough,Ongoing,Prevention,Flood Risk Area,2022
Assess the need for water level and rain gauges and develop an early warning system for surface water flooding at priority locations in Gloucestershire,Not started - proposed,Preparedness,River Basin District,2027
Assess the need for water level and rain gauges and develop early warning systems for flooding from Ordinary Watercourses at priority locations in the Shropshire Council area,Not started - proposed,Preparedness,River Basin District,2027
Assess the potential impact of climate change in Sparkhill,Not started - proposed,Prevention,Flood Risk Area,2021 to 2027
Assess the potential impacts of climate change on the town including on the standard of protection provided by the flood risk management scheme in Burton upon Trent,Not started - proposed,Prevention,Flood Risk Area,2021 to 2027
"Assess the potential impacts of climate change on the town including on the standard of protection provided by the flood risk management scheme in Henley-in-Arden
",Not started - proposed,Prevention,Flood Risk Area,2021 to 2027
"Assess the potential impacts of climate change, including on the standard of protection provided by flood defences in Beeston",Not started - proposed,Prevention,Flood Risk Area,2021 to 2027
"Assess the potential impacts of climate change, including on the standard of protection provided by flood defences in Long Eaton",Not started - proposed,Preparedness,Flood Risk Area,2021 to 2027
"Assess the potential impacts of climate change, including on the standard of protection provided by flood defences in West Bridgford",Not started - proposed,Recovery and Review,Flood Risk Area,2021 to 2027
"Assess the potential impacts of climate change, including on the standard of protection provided by flood defences, in Fazeley, Tamworth",Not started - proposed,Prevention,Flood Risk Area,2021 to 2027
"Assess the potential impacts of climate change, including on the standard of protection provided by flood defences, under the Isle of Axholme Strategy in Stainforth",Not started - proposed,Prevention,Flood Risk Area,2021 to 2027
"Assess the potential impacts of climate change, including on the standard of protection provided by flood defences, under the Isle of Axholme Strategy in Thorne and Moorends",Not started - proposed,Prevention,Flood Risk Area,2021 to 2027
"Assess the potential impacts of climate change, including on the standard of protection provided by the flood risk management schemes, in Selly Park",Not started - proposed,Prevention,Flood Risk Area,2021 to 2027
Assess the role of North Ditch pumping station (off Bridges Road) in managing current and future flood risk in the Stanlow / Wolverham areas,Not started - proposed,Prevention,Flood Risk Area,2024
Assess the role of raised defences and develop a flood risk and asset management strategy in the River Severn/River Vyrnwy confluence area,Not started - proposed,Protection,Management Catchment,2021 to 2027
Assess the standard of service of existing defences along the Eastbourne to Cooden frontage and investigate options for future beach management in Eastbourne to Cooden,Ongoing,Prevention,Flood Risk Area,2021 to 2025
"Assess the strategic need for key assets and their future operational requirements, in accordance with the development of the flood risk management strategy in the Somerset Levels and Moors",Ongoing,Prevention,Strategic Area,2021 to 2027
Assess the surface water capacity of public sewer networks in high risk critical drainage areas in Southwark,Not started - proposed,Prevention,Flood Risk Area,2021 to 2027
Assess the viability of using Nanpanton reservoir in the Wood Brook catchment,Not started - proposed,Protection,Flood Risk Area,2027
Assess the way flood risk is managed in the identified areas in northern England,Ongoing,Prevention,River Basin District,2021 to 2027
Assess the way flood risk is managed in the identified areas in the North West of England,Ongoing,Prevention,River Basin District,2021 to 2027
Assess the way flood risk is managed within identified areas in northern England,Ongoing,Prevention,River Basin District,2021 to 2027
Assess the way flood risk is managed within identified areas in the North West of England,Ongoing,Prevention,River Basin District,2021 to 2027
Attend quarterly catchment partnership meetings in Essex,Ongoing,Prevention,Flood Risk Area,2021 to 2027
Begin to implement long-term whole-life asset management plans in North East of England,Ongoing,Protection,River Basin District,2022
Begin to implement long-term whole-life asset management plans in northern England,Not started - proposed,Prevention,River Basin District,2023
Begin to implement long-term whole-life asset management plans in the North West of England,Not started - proposed,Prevention,River Basin District,2023
"Build up a prioritised evidence base of at risk infrastructure (of global, national, regional and local importance) from current and future flooding sources through the use of flood risk mapping in London Borough of Sutton",Not started - proposed,Protection,Flood Risk Area,2021 to 2027
Build upon evidence gathered through River Thames Scheme study to progress appraisal of preferred options in Datchet,Not started - agreed,Protection,Flood Risk Area,2021 to 2027
Build upon evidence gathered through River Thames Scheme study to progress appraisal of preferred options in Old Windsor and Wraysbury,Not started - agreed,Protection,Flood Risk Area,2021 to 2027
Carry out a Flood Action Campaign in Canterbury,Ongoing,Preparedness,Flood Risk Area,2021 to 2027
Carry out a Flood Action Campaign in Herne Bay,Ongoing,Preparedness,Flood Risk Area,2021 to 2027
Carry out a Flood Action Campaign in Hythe,Ongoing,Preparedness,Flood Risk Area,2021 to 2027
Carry out a Flood Action Campaign in Whitstable,Ongoing,Preparedness,Flood Risk Area,2021 to 2027
"Carry out a combination of natural flood risk management, tree planting and habitat creation in the Severn Valley",Not started - proposed,Protection,River Basin District,2021 to 2027
Carry out a community capacity building programme to support communities to be more prepared for flooding and encourage local action in Warwickshire,Ongoing,Protection,Management Catchment,2027
Carry out a community capacity building programme to support communities to be more prepared for flooding and encourage local action in Warwickshire,Ongoing,Preparedness,Management Catchment,2027
Carry out a flood investigation,Not started - proposed,Protection,Flood Risk Area,2021 to 2027
Carry out a flood investigation in Attleborough,Not started - proposed,Prevention,Management Catchment,2021 to 2027
Carry out a flood investigation in Clenchwarton,Not started - proposed,Protection,Management Catchment,2021 to 2027
Carry out a flood risk and asset management strategy for the River Lugg catchment in Herefordshire,Not started - proposed,Protection,Management Catchment,2027
Carry out a flood risk and asset management strategy for the River Tern catchment in Shropshire,Not started - proposed,Protection,Management Catchment,2027
Carry out a flood risk and asset management strategy for the River Wye catchment in Herefordshire,Not started - proposed,Protection,Management Catchment,2027
Carry out a flood risk and asset management strategy in the River Arrow catchment,Not started - proposed,Protection,Flood Risk Area,2021 to 2027
Carry out a flood risk and asset management strategy in the River Avon catchment,Not started - proposed,Protection,Management Catchment,2021 to 2027
Carry out a flood risk and asset management strategy in the River Severn catchment,Not started - proposed,Protection,River Basin District,2021 to 2027
"Carry out a geomorphology study to identify opportunities to understand sediment transfer throughout catchments in Devon, Cornwall and the Isles of Scilly",Not started - proposed,Other,River Basin District,2027
"Carry out a programme of engagement with communities to discuss maintenance regimes in Devon, Cornwall and the Isles of Scilly",Not started - proposed,Protection,River Basin District,2027
"Carry out a programme of modelling and feasibility studies to reduce flood risk from brooks in Hereford, Wellington and Canon Pyon",Ongoing,Protection,Management Catchment,2021 to 2027
Carry out a programme of small remediation works in West Berkshire,Not started - proposed,Protection,Flood Risk Area,2021 to 2027
Carry out a review of legacy assets in Ditton,Not started - proposed,Protection,Flood Risk Area,2021 to 2027
Carry out a review of legacy assets in East Peckham,Not started - proposed,Protection,Flood Risk Area,2021 to 2027
Carry out a review of legacy assets in Five Oak Green,Not started - proposed,Protection,Flood Risk Area,2021 to 2027
Carry out a review of legacy assets in London and Thames Estuary,Not started - proposed,Protection,Flood Risk Area,2021 to 2027
Carry out a review of legacy assets in Rochester,Not started - proposed,Protection,Flood Risk Area,2021 to 2027
Carry out a review of legacy assets in Tonbridge,Not started - proposed,Protection,Flood Risk Area,2021 to 2027
Carry out a review of legacy assets in Yalding,Not started - proposed,Protection,Flood Risk Area,2021 to 2027
Carry out a review of the Wash East Coastal Management Strategy along the coast in between Heacham and Snettisham,Not started - proposed,Protection,Management Catchment,2025 to 2027
Carry out a review of the Wash East Coastal Management Strategy in Hunstanton,Not started - proposed,Prevention,Flood Risk Area,2025 to 2027
Carry out a scoping study in the Borough,Ongoing,Prevention,Flood Risk Area,2027
Carry out a strategic assessment in London Borough of Barnet,Not started - proposed,Preparedness,Flood Risk Area,2027
"Carry out a strategic assessment to better understand and communicate the impact of the tidal River Thames in and along the River Colne, River Brent, and River Crane and on the non-tidal section of the River Thames in west London",Not started - proposed,Preparedness,Flood Risk Area,2027
Carry out a strategic flood study,Not started - proposed,Protection,Flood Risk Area,2021 to 2027
Carry out a strategic review of Environment Agency debris screen assets in North East of England,Ongoing,Preparedness,River Basin District,2027
Carry out a strategic review of Environment Agency debris screens in northern England,Not started - proposed,Prevention,River Basin District,2027
Carry out a strategic review of Environment Agency debris screens in the North West of England,Not started - proposed,Prevention,River Basin District,2027
Carry out a structural assessment of flood risk assets on the River Lemon in Newton Abbot,Ongoing,Protection,Flood Risk Area,2024
Carry out a study in to the flood risk in Constable Lee,Not started - proposed,Prevention,Flood Risk Area,2024 to 2025
"Carry out a study to highlight waste sites that are at risk of flooding in Devon, Cornwall and the Isles of Scilly",Not started - proposed,Preparedness,River Basin District,2024
"Carry out a study to identify critical debris screens and develop a programme of improvement works in Devon, Cornwall and the Isles of Scilly",Not started - proposed,Protection,River Basin District,2027
"Carry out a study to identify priority opportunities for promotion of property flood resilience measures and promote tools and funding opportunities available to relevant properties in Devon, Cornwall and the Isles of Scilly",Not started - proposed,Preparedness,River Basin District,2024
"Carry out a study to identify sites for future adaptation pathways in Devon, Cornwall and the Isles of Scilly",Not started - proposed,Preparedness,River Basin District,2024
"Carry out an Asset Review and Modelling Study in the River Tame catchment
",Not started - proposed,Protection,Management Catchment,2021 to 2027
Carry out an appraisal of options following modelling in the River Piddle,Ongoing,Prevention,Management Catchment,2027
Carry out an assessment for a flood storage area on Dimore Brook in the Fishers Meadow area in Gloucester,Not started - proposed,Protection,Flood Risk Area,2027
Carry out an assessment of flood risk assets for the Exwick Flood Relief Channel in Exeter,Not started - proposed,Prevention,Flood Risk Area,2024
Carry out an assessment of potential desilting and ditch clearing works in the West Mardyke Main River,Not started - agreed,Protection,Flood Risk Area,2027
Carry out an assessment to identify and understand the most vulnerable communities in the London and Thames Estuary Flood Risk Area,Not started - proposed,Preparedness,Flood Risk Area,2024
Carry out an investigation in to the flood risk in Rawtenstall Town Centre,Not started - proposed,Prevention,Flood Risk Area,2024 to 2025
"Carry out an investigation to understand the combined flood risk to existing businesses, properties and infrastructure at risk in Waterfoot",Not started - proposed,Prevention,Flood Risk Area,2023 to 2024
Carry out an study of the Alphin Brook catchment and its assets in Exeter,Not started - proposed,Protection,Flood Risk Area,2024
Carry out annual asset inspections on completed capital schemes to review maintenance needs in Essex,Ongoing,Protection,Flood Risk Area,2021 to 2027
Carry out capital works which may include both natural flood management and traditional flood risk management options in the Alconbury Brook catchment,Not started - proposed,Protection,Flood Risk Area,2021 to 2027
Carry out critical drainage area flood modelling in the Brent London Borough,Not started - proposed,Prevention,Flood Risk Area,2027
Carry out early engagement and work with local residents in the Lee Valley,Not started - agreed,Protection,Strategic Area,2027
Carry out feasibility modelling in Woodcock Park,Not started - agreed,Prevention,Flood Risk Area,2027
Carry out flood modelling in Havering Park Critical Drainage Area,Ongoing,Preparedness,Flood Risk Area,2027
Carry out flood modelling of main river and adjacent educational facility in the Harold Hill Critical Drainage Area,Ongoing,Prevention,Flood Risk Area,2027
Carry out joint walkovers of the watercourses in Saffron Walden,Not started - proposed,Protection,Flood Risk Area,2021 to 2027
"Carry out large scale tree planting and potentially the creation of other habitats (peatland, wetlands etc) in various places in the Environment Agency West Midlands Area of the Trent catchment",Not started - proposed,Protection,River Basin District,2021 to 2027
Carry out modelling in Gillingham and Upper Stour,Not started - proposed,Prevention,Management Catchment,2027
Carry out public engagement to encourage update of small-scale sustainable drainage systems in Southwark,Ongoing,Prevention,Flood Risk Area,2021 to 2027
Carry out specific flood awareness activities through the medway flood partnership and the flood action campaign in East Peckham,Not started - proposed,Preparedness,Flood Risk Area,2021 to 2022
Carry out specific flood awareness activities through the medway flood partnership and the flood action campaign in Five Oak Green,Not started - proposed,Preparedness,Flood Risk Area,2021 to 2027
Carry out specific flood awareness activities through the medway flood partnership and the flood action campaign in Tonbridge,Not started - proposed,Preparedness,Flood Risk Area,2021 to 2027
Carry out specific flood awareness activities through the medway flood partnership and the flood action campaign in Yalding,Not started - proposed,Preparedness,Flood Risk Area,2021 to 2027
"Carry out studies to better understand the condition of the existing flood defences, and hydraulic modelling to establish the benefits the defences provide (at present and when considering climate change) prior to progressing capital works to sustain, and where appropriate improve, the tidal flood defences  in Great Yarmouth",Not started - proposed,Protection,Flood Risk Area,2026
Carry out survey work and develop a new hydraulic model for the Burstow Stream and tributaries in Burstow catchment,Ongoing,Preparedness,Flood Risk Area,2022
Carry out the Beach Management Scheme in Poole Bay (Sandbanks to Hengistbury Head),Ongoing construction,Protection,Management Catchment,2032
Carry out the Bourne Stream Outfall Screens Scheme in Bournemouth,Not started - proposed,Protection,Management Catchment,2028
"Carry out the Fleetsbridge and Hatch Pond Flood Attenuation and Natural Flood Management project in Fleetsbridge, Poole",Ongoing,Protection,Management Catchment,2028
Carry out the Lower Way and West Thatcham flood alleviation schemes,Not started - proposed,Prevention,Flood Risk Area,2021 to 2027
Carry out the Shoreline Management Plan-Refresh recommendations in Poole and Christchurch Bays,Ongoing,Prevention,Management Catchment,2025
Carry out the flood action campaign in Ditton,Not started - proposed,Preparedness,Flood Risk Area,2021 to 2027
Carry out the flood action campaign in London and Thames Estuary,Not started - agreed,Recovery and Review,Flood Risk Area,2021 to 2027
Carry out the flood action campaign in Rochester,Not started - proposed,Preparedness,Flood Risk Area,2021 to 2027
Carry out the flood action campaign in Smallfield,Not started - agreed,Preparedness,Flood Risk Area,2027
Carry out works to repair and improve the Alcester flood risk management scheme to increase the standard of protection it provides in Alcester,Ongoing,Protection,Management Catchment,2021 to 2027
Co-operate and collaborate with Lead Local Flood Authority led Section 19 flood investigations in STW wastewater catchments,Ongoing,Recovery and Review,River Basin District,2021 to 2025
Collaborate to improve modelling of hydraulic systems in Hinckley and Burbage,Ongoing,Prevention,Flood Risk Area,2021 to 2027
Collaborate to improve modelling of surface water and watercourses in Loughborough,Not started - agreed,Prevention,Flood Risk Area,2021 to 2027
Collaborate with Environmental Partners and major landowners to increase peatland and wetland restoration in North East of England,Ongoing,Other,River Basin District,2027
Collaborate with environmental partners and major landowners to significantly increase upland and lowland peat and wetland restoration in northern England,Ongoing,Protection,River Basin District,2027
Collaborate with environmental partners and major landowners to significantly increase upland and lowland peat and wetland restoration in the North West of England,Not started - proposed,Protection,River Basin District,2027
Collaborate with key partners and stakeholders in the Colne Management Catchment,Not started - proposed,Preparedness,Strategic Area,2027
Collaborate with partner organisation to ensure that the Flood Alleviation Schemes incorporate environmental benefits wherever possible in Leeds,Ongoing,Other,Management Catchment,2027
"Collaborate with partner organisations, to research and monitor the impact on flood plain reconnection schemes on sediment and water flows, in the Lower and Upper Witham,",Not started - agreed,Protection,Management Catchment,2021 to 2027
Collaborate with partners in the Middle Lee Strategic Area,Not started - proposed,Prevention,Strategic Area,2027
"Collate information, including condition and maintenance activities, on sea defence and coastal protection assets in northern England",Ongoing,Prevention,River Basin District,2021 to 2027
"Collate information, including condition and maintenance activities, on sea defence and coastal protection assets in the North West of England",Ongoing,Prevention,River Basin District,2021 to 2027
"Commence a joint investigation into the flooding mechanisms and future flood risk in Fulledge, Culshaw Street and Elliot Street, Burnley,",Not started - proposed,Prevention,Flood Risk Area,2022 to 2023
Commence using the North West Sustainable Drainage Systems proforma in pre-application discussions and potentially within the planning validation process in the wider Burnley area,Not started - proposed,Prevention,Flood Risk Area,2020 to 2021
Commence using the North West Sustainable Drainage Systems proforma in pre-application discussions and potentially within the planning validation process in the wider Rossendale area,Not started - proposed,Prevention,Flood Risk Area,2021 to 2022
Comment on planned critical infrastructure schemes through the planning process and Lead Local Flood Authority role in Gloucestershire,Ongoing,Prevention,River Basin District,2027
Comment on planning applications (and Sustainable Drainage Systems Approving Body applications in neighbouring areas of Wales) to control the impact of new sewer connections in DCWW wastewater catchments,Ongoing,Prevention,River Basin District,2021 to 2027
Commission a feasibility study in and across the Lee Valley,Not started - proposed,Preparedness,Strategic Area,2025
"Commission a feasibility study to understand the impact of de-culverting in and along the Salmons Brook, Pymmes Brook, Ching Brook, Stonebridge Brook, and other key River Lee tributaries",Not started - proposed,Preparedness,Flood Risk Area,2024
