Description,Status,Type,Scale,Timetable
"Progress investigations into feasible and practicable small scale options in the Leven catchment, including Ambleside,",Not started - proposed,Protection,Flood Risk Area,2021 to 2027
"Progress natural flood management measures, with wider benefits in the Blackburn with Darwen Catchment Areas",Not started - proposed,Protection,Flood Risk Area,2027
Progress partnership work in Barrow Upon Humber and Barton Upon Humber,Not started - proposed,Preparedness,Management Catchment,2021 to 2027
Progress the Enfield Chase Restoration Project by delivering Natural Flood Management measures including wetland and woodland creation in Enfield,Ongoing,Protection,Flood Risk Area,2023
Progress the Halton Marshes Phase 2 flood alleviation scheme taking an adaptive approach in Immingham,Not started - agreed,Protection,Flood Risk Area,2021 to 2027
Progress the Hastings Central Flood Alleviation Scheme in Hastings,Ongoing,Protection,Flood Risk Area,2023
Progress the Lower Witham Flood Resilience Project to establish a programme to improve and sustain work in the Lower Witham catchment,Ongoing,Protection,Management Catchment,2021 to 2027
Progress the River Slea Flood Resilience Project to establish a programme of river restoration and flood risk improvement in Sleaford and surrounding areas,Ongoing,Protection,Management Catchment,2021 to 2025
Progress the Southern Derby Surface Water Management Strategy in Derby,Not started - proposed,Prevention,Flood Risk Area,2027
Progress the appraisal of the preferred options of the Colnbrook flood alleviation scheme in Colnbrook,Ongoing,Protection,Strategic Area,2027
"Progress the catchment management approach within the Middle Ancholme in Brigg,",Not started - proposed,Protection,Flood Risk Area,2021 to 2027
Progress the delivery of the first phase in the Saltfleet to Gibraltar Point Strategy area,Not started - agreed,Protection,Management Catchment,2021 to 2027
"Progress the flood alleviation scheme, including consideration to utilising nature based solutions, in Rawreth and Rawreth Shot",Ongoing,Protection,Management Catchment,2021 to 2027
Promote flood risk awareness by engaging with at risk communities and prioritising at risk areas in Ealing,Not started - proposed,Preparedness,Flood Risk Area,2027
Promote local surface water management among residents in Bromley Borough,Ongoing,Prevention,Flood Risk Area,2021 to 2027
"Promote natural flood risk management as a complementary element of flood risk management schemes and work with landowners to identify locations for natural flood management measures  in Gloucestershire
",Ongoing,Protection,River Basin District,2027
Promote retrofit sustainable drainage interventions through involvement with Newbury Town Centre Project,Not started - proposed,Protection,Flood Risk Area,2021 to 2027
"Promote sustainable surface water drainage arrangements for new and future development, in their role as statutory consultees, in Northwest Crawley",Not started - proposed,Prevention,Flood Risk Area,2021 to 2027
"Promote sustainable surface water drainage arrangements for new and future development, in their role as statutory consultees, in Salvington, Durrington and West Tarring",Not started - proposed,Prevention,Flood Risk Area,2021 to 2027
Promote the Shoreline Management Plan with Local Planning Authorities in northern England,Ongoing,Prevention,River Basin District,2021 to 2027
Promote the Shoreline Management Plan with Local Planning Authorities in the North West of England,Ongoing,Prevention,River Basin District,2021 to 2027
Promote understanding of critical flood risk assets through engagement with local communities,Not started - proposed,Preparedness,Flood Risk Area,2021 to 2027
"Provide advice to the local planning authority, in response to consultations about proposed development in areas at risk of flooding in Camden",Ongoing,Prevention,Flood Risk Area,2027
"Provide education to raise awareness of, and promote action against, disposing fats, oils, grease and un-flushable materials into the sewer network in STW wastewater catchments",Ongoing,Prevention,River Basin District,2021 to 2025
Provide evidence and advice to HS2 in the Upper Ouse catchment,Ongoing,Prevention,Management Catchment,2027
"Provide evidence and advice to relevant service and infrastructure providers with assets at risk of flooding in Birmingham, Dudley, Sandwell and Solihull",Not started - proposed,Protection,Flood Risk Area,2027
Provide guidance about resilience measures to owners of key infrastructure at significant flood risk in Canvey Island,Ongoing,Prevention,Flood Risk Area,2022
Provide guidance about resilience measures to owners of key infrastructure at significant flood risk in Chelmsford,Ongoing,Prevention,Flood Risk Area,2022
Provide guidance about resilience measures to owners of key infrastructure at significant flood risk in Colchester,Ongoing,Prevention,Flood Risk Area,2022
Provide guidance about resilience measures to owners of key infrastructure at significant flood risk in Harlow,Ongoing,Prevention,Flood Risk Area,2022
Provide guidance about resilience measures to owners of key infrastructure at significant flood risk in South Essex,Ongoing,Prevention,Flood Risk Area,2022
"Provide information and opportunities to the education sector, raising awareness of drainage, flood and coastal issues in northern England",Not started - proposed,Preparedness,River Basin District,2027
"Provide information and opportunities to the education sector, raising awareness of drainage, flood and coastal issues in the North West of England",Not started - proposed,Preparedness,River Basin District,2027
Provide information and support infrastructure owners to help them assess their flood risk and take adaptive measures in Coventry,Not started - proposed,Preparedness,Flood Risk Area,2027
"Provide information to inform spatial and infrastructure planning, development and regeneration in their area",Ongoing,Prevention,National,2021 to 2027
Provide local groundwater flood risk map linked to conditions that result in flood risk to particular areas in Bexley Borough,Ongoing,Protection,Flood Risk Area,2021 to 2027
Provide maps that show sites where culverts could be opened and Green Sustainable Drainage Systems implemented in Macclesfield,Not started - proposed,Prevention,Flood Risk Area,2024
Provide quality and timely planning advice to help avoid inappropriate development in areas at risk of flooding in England,Ongoing,Prevention,National,2021 to 2027
"Provide strategic flooding, coastal risk and climate change guidance to partners and the community in Looe",Ongoing,Protection,Management Catchment,2021 to 2027
Provide training and promote knowledge sharing amongst individuals and departments involved in the planning process in the Royal Borough of Kingston upon Thames,Not started - proposed,Protection,Flood Risk Area,2021 to 2027
Provide upstream storage capacity to address surface water issues on Battle Road and Pembroke Road in Erith,Ongoing,Protection,Flood Risk Area,2024
"Publish Shropshire specific developer guidance on the delivery of sustainable drainage systems in new development in the Shropshire Council area
",Not started - proposed,Prevention,River Basin District,2023
"Publish a tool to raise awareness and enable residents, businesses, infrastructure owners and service providers to better prepare for flooding in the Walsall Metropolitan Borough Council area",Not started - proposed,Preparedness,Flood Risk Area,2024
"Publish a tool to raise awareness and enable residents, businesses, infrastructure owners and service providers to better prepare for flooding in the Wolverhampton Borough area",Not started - proposed,Preparedness,Flood Risk Area,2024
Publish and begin implementing a programme of flood alleviation schemes in Hounslow,Not started - proposed,Protection,Flood Risk Area,2027
"Publish and begin implementing a programme of flood alleviation schemes which mitigate local flood risks, utilising a catchment-based approach in Richmond",Not started - proposed,Protection,Flood Risk Area,2021 to 2027
"Publish and begin implementing a programme of flood alleviation schemes which mitigate local flood risks, utilising a catchment-based approach in Wandsworth",Not started - proposed,Protection,Flood Risk Area,2021 to 2027
Publish and update progress reports on implementation of actions identified in statutory Flood Investigation Reports produced in Haltemprice,Ongoing,Recovery and Review,Flood Risk Area,2027
Publish guidance for residents on retrofitting sustainable drainage systems and depaving in Lambeth Borough,Not started - proposed,Prevention,Flood Risk Area,2022
Publish information and hold public engagement events in Southend,Not started - proposed,Preparedness,Flood Risk Area,2021 to 2027
"Pursue grant applications for a Property Flood Resilience scheme for Tull Way, Cold Ash and Dunstan Park in Thatcham",Not started - proposed,Prevention,Flood Risk Area,2021 to 2027
Raise awareness of flood risk by engaging with the community,Not started - proposed,Preparedness,Flood Risk Area,2021 to 2027
"Raise awareness of, and promote action against, the disposal of fats, oils, grease and unflushable materials into the sewer network in DCWW wastewater catchments",Ongoing,Prevention,River Basin District,2021 to 2027
"Reappraise the beneficial functions of the original Ipswich Flood Defences and other flood risk management assets located upstream of the tidal barrier, in partnership with Ipswich Borough Council, Suffolk County Council and other asset owners where appropriate in Ipswich",Not started - proposed,Protection,Flood Risk Area,2021 to 2027
Reassess sustainable urban drainage system projects and surface water hotspots in the borough,Ongoing,Protection,Flood Risk Area,2027
Reassess sustainable urban drainage systems projects and surface water hotspots in the borough,Not started - proposed,Preparedness,Flood Risk Area,2024
Redesign the Lead Local Flood Authority website pages in Newham,Not started - proposed,Other,Flood Risk Area,2027
Refresh and publish a revised Strategic Flood Risk Assessment in an online map format to engage more effectively with developers and the public in understanding existing and future flood risk. in Merton,Ongoing,Preparedness,Flood Risk Area,2021
Refurbish the Lapperditch Pumping Station enabling pumping of floodwater from land to continue in the future in Longney,Not started - proposed,Protection,Management Catchment,2023
Refurbish the flood defence assets in the lower reaches of the Bristol Frome,Ongoing,Protection,Flood Risk Area,2027
"Regularly review Local Flood Risk Management Strategy Action Plan, taking into account recent flood events, and produce a prioritised list of capital works in Gloucestershire
",Ongoing,Protection,River Basin District,2027
Regulate large raised reservoirs in England,Ongoing,Prevention,National,2021 to 2027
Regulate new works to main rivers and sea defences in England,Ongoing,Prevention,National,2021 to 2027
Regulate the condition of and third party activity on ordinary watercourses and review new works on ordinary watercourses in their area,Ongoing,Protection,National,2021 to 2027
Reinstate the Cotton Brook culvert to a good condition in Derby,Not started - proposed,Prevention,Flood Risk Area,2021 to 2027
Remove and control invasive pennywort on the Langney Haven and Crumbles Sewer and monitor for spread on adjoining watercourses in Langney,Ongoing,Protection,Flood Risk Area,2021 to 2027
"Repair the River Frome outfall to the Severn Estuary, repair badger damage in the River Frome embankment and carry out associated environmental works in the Upper Framilode area",Not started - proposed,Protection,Management Catchment,2021 to 2027
Replace the culvert through the West Hythe Dam on the Royal Military Canal in West Hythe,Not started - proposed,Protection,Flood Risk Area,2025 to 2027
Research and work with partners and Non Governmental Organisations to identify planning & development risks and opportunities in Staffordshire,Not started - proposed,Prevention,River Basin District,2021 to 2027
Respond to flood events and support other emergency responders in England,Ongoing,Recovery and Review,National,2021 to 2027
Respond to incidents of sewer flooding including working with local resilience forums and Civil Contingencies Act Category 1 and 2 responders in STW wastewater catchments,Ongoing,Recovery and Review,River Basin District,2021 to 2025
"Review Flood Warning Area extents and thresholds after each flood incident, or when new mapping and modelling is made available in Brigg",Ongoing,Preparedness,Flood Risk Area,2021 to 2027
"Review Flood Warning Area extents and thresholds after each flood incident, or when new mapping and modelling is made available in Cleethorpes",Ongoing,Preparedness,Flood Risk Area,2021 to 2027
"Review Flood Warning Area extents and thresholds after each flood incident, or when new mapping and modelling is made available in Immingham,",Ongoing,Preparedness,Flood Risk Area,2021 to 2027
"Review Flood Warning Area extents and thresholds after each flood incident, or when new mapping and modelling is made available in Northampton,",Ongoing,Preparedness,Flood Risk Area,2021 to 2027
"Review Flood Warning Area extents and thresholds after each flood incident, or when new mapping and modelling is made available in Spalding,",Ongoing,Preparedness,Flood Risk Area,2021 to 2027
"Review Flood Warning Area extents and thresholds after each flood incident, or when new mapping and modelling is made available in Wisbech,",Ongoing,Preparedness,Flood Risk Area,2021 to 2027
Review Kingston web pages to ensure they include all relevant information on flood risk for the borough and links to external websites where suitable in the Royal Borough of Kingston upon Thames,Ongoing,Preparedness,Flood Risk Area,2021 to 2027
Review Local Flood Risk Management Strategy Action Plan taking into account flooding in winter 2019/20 and discussions with General Scrutiny Committee in Herefordshire,Ongoing,Prevention,River Basin District,2021 to 2027
Review Shoreline Management Plan 2 Policies and capital investment programme taking account of current guidance and climate change predictions in northern England,Ongoing,Prevention,River Basin District,2022
Review Shoreline Management Plan 2 Policies and capital investment programme taking account of current guidance and climate change predictions in the North West of England,Ongoing,Prevention,River Basin District,2022
Review Surface Water Management Plans for critical infrastructure in Thurrock,Not started - proposed,Other,Flood Risk Area,2021 to 2027
"Review and comment on planning applications (using a prioritised risk based approach), and engage with developers in STW wastewater catchments
",Ongoing,Prevention,River Basin District,2021 to 2025
Review and identify opportunities to incorporate flood storage with wider capital works in Lewisham,Ongoing,Protection,Flood Risk Area,2021 to 2027
Review and implement modifications (as required) to the flood warning system in Lowestoft,Not started - proposed,Preparedness,Flood Risk Area,2026
"Review and improve the existing process of emergency preparedness, responding to flooding incidents and post-flood recovery in London Borough of Barnet",Not started - proposed,Preparedness,Flood Risk Area,2027
Review and prioritise opportunities to minimise run-off from areas of hardstanding in Lewisham,Ongoing,Protection,Flood Risk Area,2021 to 2027
Review and refine the surface water modelling (as appropriate) incorporating models from partners in the borough,Not started - proposed,Recovery and Review,Flood Risk Area,2023
"Review and refresh information provided to communities, landowners and businesses to improve understanding and awareness of riparian responsibilities in the Shropshire Council area",Not started - proposed,Protection,River Basin District,2027
"Review and refresh the 'Waterside Living' leaflet and other published information provided to communities, landowners and businesses in Gloucestershire",Not started - proposed,Protection,River Basin District,2027
Review and update coastal flood warning thresholds and fluvial flood forecasting modelling in Mounts Bay,Not started - proposed,Preparedness,Flood Risk Area,2025
"Review and update existing 'significant' definition for structures and features within London Borough of Sutton's flood risk asset register to ensure it reflects potential future risks. By 2027, assets with the greatest significance will have site-specific maintenance plans agreed with the landowner in London Borough of Sutton",Not started - proposed,Protection,Flood Risk Area,2021 to 2027
Review and update flood forecasting modelling in St Blazey and Par,Not started - proposed,Preparedness,Flood Risk Area,2027
Review and update hydrometric monitoring requirements in Mounts Bay,Not started - proposed,Preparedness,Flood Risk Area,2027
Review and update recommendations and strategies in the Surface Water Management Plan in Eastbourne,Not started - agreed,Prevention,Flood Risk Area,2023
Review and update recommendations and strategies in the Surface Water Management Plan in Hastings,Not started - agreed,Prevention,Flood Risk Area,2023
Review and update river level and flow monitoring in the catchment in St Blazey and Par,Not started - proposed,Preparedness,Flood Risk Area,2027
Review and update the Flood Risk Management Strategy and action plan in the borough,Ongoing,Preparedness,Flood Risk Area,2024
"Review and update the Local Flood Risk Management Strategy/Action Plan so that our aims and objectives align with the objectives of the FCERM Strategy, and the strategic plans of RMAs to ensure we are working toward common goals in Croydon",Not started - proposed,Preparedness,Flood Risk Area,2027
Review and update the Multi Agency Flood Plan to include emergency response plans for critical infrastructure in the Kendal area,Not started - proposed,Preparedness,Flood Risk Area,2025
Review and update the River Derwent Model in Derbyshire,Not started - agreed,Prevention,Flood Risk Area,2021 to 2027
"Review and update the existing Critical Drainage Areas within the borough, and use the data to develop maps and guidelines that will inform local planning policies to ensure that all new development in areas at risk will take into account the risk of flooding now and in the future in Croydon",Not started - proposed,Prevention,Flood Risk Area,2027
Review and update the flood risk policy in Islington,Ongoing,Prevention,Flood Risk Area,2027
Review and update the flood risk policy in Royal borough of Kensington and Chelsea's Local Plan,Ongoing,Preparedness,Flood Risk Area,2024
Review and update the significant definition within the asset register to ensure it reflects potential future risks in Richmond,Not started - proposed,Protection,Flood Risk Area,2027
Review and update the significant definition within the asset register to ensure it reflects potential future risks in Wandsworth,Not started - proposed,Protection,Flood Risk Area,2027
"Review and work to secure potential sources of local revenue funding streams in Devon, Cornwall and the Isles of Scilly",Not started - proposed,Other,River Basin District,2027
Review asset maintenance regimes and inspection programmes in Long Eaton,Ongoing,Protection,Flood Risk Area,2021 to 2027
Review blockage risks at highway crossings and identify potential Natural Flood Management and environment improvement sites in Riveracre Brook (Great Sutton to Overpool) and Gale Brook (Thornton-le-Moors),Not started - proposed,Protection,Flood Risk Area,2024
Review collaborative flood incident response and recovery processes in the Atherton Flood Risk Area,Not started - proposed,Recovery and Review,Flood Risk Area,2024
Review collaborative flood incident response and recovery processes in the Higher Folds Flood Risk Area,Not started - proposed,Recovery and Review,Flood Risk Area,2024
Review existing Water Framework Directive Heavily Modified Waterbodies in South West England,Not started - proposed,Other,River Basin District,2024
Review existing Water Framework Directive Heavily Modified Waterbodies in the Environment Agency Wessex and West Midlands Areas,Not started - proposed,Protection,River Basin District,2021 to 2027
Review existing groundwater monitoring stations and consider possibility of adding a local monitoring borehole in Bromley Borough,Ongoing,Preparedness,Flood Risk Area,2021 to 2027
Review flood risk and update the Golden Brook model in Long Eaton,Not started - agreed,Prevention,Flood Risk Area,2021 to 2027
Review flood risk from Bramble Brook in Derby,Not started - proposed,Prevention,Flood Risk Area,2027
"Review gravel management activities, produce gravel management plans and identify priority areas to work with natural processes in the upstream catchment, in and around the Kendal area,",Not started - proposed,Protection,Flood Risk Area,2025
"Review gravel management activities, to assess the suitability of appropriate gravel management procedures in and around the Rawtenstall area",Not started - proposed,Prevention,Flood Risk Area,2021 to 2022
"Review hydrometric monitoring networks in relation to flood warnings, and revise flood warning areas and trigger levels in Nottinghamshire, Derbyshire, Leicestershire",Ongoing,Preparedness,River Basin District,2021 to 2027
Review impacts of flood map changes and consider providing a groundwater alert service,Ongoing,Prevention,Flood Risk Area,2021 to 2027
Review maintenance standards of main rivers and ordinary watercourses in the Formby Flood Risk Area,Not started - proposed,Protection,Flood Risk Area,2023
Review maintenance standards of main rivers and ordinary watercourses in the Liverpool area,Not started - proposed,Protection,Flood Risk Area,2025
Review maintenance standards of main rivers and ordinary watercourses in the Southport flood risk areas,Not started - proposed,Protection,Flood Risk Area,2023
Review opportunities for collaborative working through the internal flood group meetings and raise opportunities to the South West London Flood Group in Wandsworth,Ongoing,Other,Flood Risk Area,2021 to 2027
Review planning policy to promote sustainable urban drainage systems in the borough,Not started - proposed,Prevention,Flood Risk Area,2027
Review potential for a joint policy with London Borough of Bromley for upstream management and storage opportunities in Wyncham Stream,Ongoing,Preparedness,Flood Risk Area,2027
"Review potential for area specific groundwater flood warnings based on improved understanding, risk map, and monitoring in Bexley Borough",Ongoing,Preparedness,Flood Risk Area,2021 to 2027
Review previous appraisal reports and recent detailed asset inspections for the flood gates in King's Lynn,Not started - proposed,Protection,Flood Risk Area,2023
"Review recent modelling and identify if improvements to defences are required in the Midford Catchment, Bath",Not started - agreed,Prevention,Flood Risk Area,2025
"Review surface water flooding issues, due to the lack of permeable ground coverings, resulting in excessive deman on formal drainage systems in Bexley Village",Ongoing,Protection,Flood Risk Area,2027
Review the Flood Alleviation Scheme proposals in Darwen,Not started - proposed,Protection,Flood Risk Area,2023
"Review the Par River system for barriers to fish and eel passage, identify opportunities and plan improvements in St Blazey and Par",Ongoing,Other,Flood Risk Area,2027
"Review the Tidal Trent hydraulic model based on the outputs of the Humber Strategy in Nottinghamshire, North Lincolnshire and Lincolnshire",Not started - proposed,Prevention,Management Catchment,2021 to 2027
Review the effectiveness of the Combe Haven Sea Outfall in Bulverhythe,Not started - proposed,Prevention,Flood Risk Area,2021 to 2027
Review the evidence in the Ashton catchment,Ongoing,Prevention,Flood Risk Area,2021 to 2027
Review the existing defences at Bradfords Quay in Wadebridge,Not started - agreed,Protection,Management Catchment,2027
"Review the flood risk and, if viable, progress flood risk management measures in Fenstanton",Not started - proposed,Protection,Management Catchment,2027
Review the flood warning and forecasting needs for the river and the sea in Portreath,Not started - agreed,Preparedness,Flood Risk Area,2027
Review the flood warning trigger levels in relation to the condition of the flood defences along the coast in between Heacham and Snettisham,Not started - proposed,Preparedness,Management Catchment,2024
Review the flood warning trigger levels in relation to the condition of the flood defences in between Hunstanton and Wolferton Creek,Not started - proposed,Preparedness,Flood Risk Area,2024
"Review the function that the Manchester Ship Canal, and associated assets, performs in managing flood risk from the Mersey estuary in Ellesmere Port",Not started - proposed,Prevention,Flood Risk Area,2024
Review the heritage assets that may be at risk of flooding in the Wolverhampton Flood Risk Area,Not started - proposed,Preparedness,Flood Risk Area,2027
Review the level of protection provided by major drainage assets constructed as part of new development in Norwich,Not started - agreed,Preparedness,Flood Risk Area,2021 to 2027
Review the local flood risk in all sub-catchments within the Norwich urban area and re-assign Critical Drainage Catchments if appropriate in Norwich,Ongoing,Other,Flood Risk Area,2023
Review the operation of the Par River System in St Blazey and Par,Ongoing,Protection,Flood Risk Area,2027
Review the operation of the upstream flood storage reservoir in Louth,Not started - proposed,Preparedness,Flood Risk Area,2021 to 2027
