Description,Status,Type,Scale,Timetable
Engage with local partnerships on large projects in and along the River Stort,Not started - proposed,Protection,Strategic Area,2027
"Engage with operators of Environmental Permitting Regulations installations and facilities that are registered under Control of Major Accident Hazards Regulations to raise awareness of flood risk and to encourage preparedness in the Environment Agency West Midlands Area
",Not started - proposed,Preparedness,River Basin District,2021 to 2027
Engage with operators of Environmental Permitting Regulations sites and facilities that are registered under Control of Major Accident Hazards Regulations to raise awareness of flood risk and encourage preparedness in Humber River Basin District,Not started - proposed,Preparedness,River Basin District,2021 to 2027
Engage with property owners to improve their understanding of residual risk and measures they can take to prepare for flooding and recovery in locations in Gloucestershire where the Environment Agency is delivering property flood resilience measures,Not started - proposed,Preparedness,River Basin District,2021 to 2027
"Engage with the community at risk of rapid onset flooding to raise awareness and increase preparedness, including what they can do themselves in Llanyblodwel",Ongoing,Preparedness,Management Catchment,2021 to 2027
Engage with the landowner (United Utilities) to investigate the feasibility of Natural Flood Management in Nutshaw Hill (Dunnockshaw),Not started - proposed,Protection,Flood Risk Area,2023 to 2024
Engage with the local business community to deliver an enhanced flood event institutional emergency response plan in the Ambleside Flood Risk Area,Not started - proposed,Preparedness,Flood Risk Area,2021 to 2027
"Engage with the local community to deliver an enhanced flood event institutional emergency response plan in the Ambleside Flood Risk Area,",Not started - proposed,Preparedness,Flood Risk Area,2021 to 2025
Engage with the local community to establish Community Flood Groups in Blackburn with Darwen,Not started - proposed,Preparedness,Flood Risk Area,2026
Engage with the local community to increase sign up to the full Environment Agency Flood Warning Service in Grimsby,Not started - proposed,Preparedness,Flood Risk Area,2021 to 2027
Engage with the local community to increase sign-up to the full Environment Agency Flood Warning service in Boston,Not started - proposed,Preparedness,Flood Risk Area,2021 to 2027
Engage with the local community to increase sign-up to the full Environment Agency Flood Warning service in Horncastle,Not started - proposed,Preparedness,Flood Risk Area,2021 to 2027
Engage with the local community to increase sign-up to the full Environment Agency Flood Warning service in Lincoln,Not started - proposed,Recovery and Review,Flood Risk Area,2021 to 2022
"Engage with the local community, including caravan and campsite owners and visitors, in Mablethorpe and Sutton On Sea",Not started - proposed,Preparedness,Flood Risk Area,2021 to 2027
"Engage with the local community, including caravan and campsite owners and visitors, in Skegness, Ingoldmells and Chapel St Leonards",Not started - proposed,Preparedness,Flood Risk Area,2021 to 2027
Engage with upstream landowners to maximise the benefits of the emerging environmental land management scheme in lower Witham and South Forty Foot,Not started - proposed,Protection,Flood Risk Area,2021 to 2027
Engage with upstream landowners to maximise the benefits of the emerging environmental land management scheme in upper Witham,Not started - proposed,Protection,Flood Risk Area,2021 to 2027
Engage with vulnerable communities in Enfield,Not started - proposed,Preparedness,Flood Risk Area,2027
"Enhance existing ways of sharing FCERM information, including risk locations and programmes amongst risk management authorities in STW wastewater catchments",Not started - proposed,Prevention,River Basin District,2021 to 2025
"Enhance existing ways of sharing Flood and Coastal Erosion Risk Management information, including risk locations and programmes, amongst risk management authorities in STW wastewater catchments",Not started - proposed,Prevention,River Basin District,2021 to 2025
"Enhance the flood event institutional emergency response plan in the Ambleside Flood Risk Area,",Not started - proposed,Preparedness,Flood Risk Area,2021 to 2025
"Enhance the flood forecasting system, using the latest evidence and modelling in East Riding",Ongoing,Preparedness,Management Catchment,2027
"Enhance the flood forecasting system, using the latest evidence and modelling in North Yorkshire",Not started - proposed,Prevention,Management Catchment,2027
Enhance the natural environment and biodiversity as part of Severn Trent Water's Great Big Nature Boost campaign in STW wastewater catchments,Ongoing,Protection,River Basin District,2021 to 2027
Enhance the natural environment and biodiversity as part of our Great Big Nature Boost campaign in STW wastewater catchments,Ongoing,Prevention,River Basin District,2021 to 2027
"Ensure 100% energy use from renewable or renewable-backed sources, and electric or alternative low-carbon fuel in all Severn Trent fleet vehicles in STW wastewater catchments
",Ongoing,Other,River Basin District,2030
"Ensure 100% energy use from renewable or renewable-backed sources, and electric or alternative low-carbon fuel in all Severn Trent fleet vehicles in STW wastewater catchments
",Ongoing,Prevention,River Basin District,2030
"Ensure Carbon created by managing all sources of flood risk is reduced, offset in line with Local Carbon Reduction Plans in Devon, Cornwall and the Isles of Scilly",Not started - proposed,Other,River Basin District,2027
Ensure all new developments adhere to the local plan and reduce the risk of flooding caused by surface water run-off in Tower Hamlets,Not started - agreed,Prevention,Flood Risk Area,2027
Ensure continued availability of meteorological data in Mounts Bay,Ongoing,Preparedness,Flood Risk Area,2026
Ensure information about risk management authority goals is accessible via Local Flood Risk Management Strategy to develop a joint strategic vision in Essex,Not started - proposed,Prevention,Flood Risk Area,2022
Ensure major developers deliver flood risk betterment to existing properties where it is reasonable or necessary to do so,Ongoing,Prevention,Flood Risk Area,2021 to 2027
Ensure planning and development control will take account of all forms of flood risk and minimise development which could increase flood risk in Doncaster,Ongoing,Prevention,Management Catchment,2027
Establish a 'working together' group in the Anglian River Basin District,Not started - proposed,Protection,River Basin District,2023
Establish a Coastal Asset Management System to pro-actively manage coastal flood risk management assets in the future in areas along the Dorset Coast (Lyme Regis to Chewton Bunny),Ongoing,Prevention,Management Catchment,Ongoing
Establish a Critical Drainage Area in Cullompton,Not started - proposed,Prevention,Flood Risk Area,2024
Establish a baseline of knowledge and evidence in the Broadland area,Not started - proposed,Protection,Management Catchment,2024
Establish an infrastructure plan that identifies future risks and funding sources for potential improvements in Newton Abbot,Not started - proposed,Other,Flood Risk Area,2024
Establish an intelligence based highway drainage asset management programme in Derby,Ongoing,Preparedness,Flood Risk Area,2023
"Establish an outline investment programme, identifying priorities over 10 years, based on shared flood risk drivers, ambition and strategic objectives in northern England",Not started - proposed,Protection,River Basin District,2023
"Establish an outline investment programme, identifying priorities over 10 years, based on shared flood risk drivers, ambition and strategic objectives in the North West of England",Not started - proposed,Protection,River Basin District,2023
Establish and improve relations with key stakeholders to work together in London Borough of Barnet,Not started - proposed,Protection,Flood Risk Area,2027
Establish engagement processes for members of the public and local stakeholders in Redbridge,Not started - proposed,Preparedness,Flood Risk Area,2027
"Evaluate and, where viable, progress options for promenade repairs and resurfacing work in Hunstanton",Not started - agreed,Protection,Flood Risk Area,2025
"Expand the coverage of Flood Warning Service to communities at risk of flooding where No service is currently offered in Nottinghamshire, Derbyshire, Leicestershire",Ongoing,Preparedness,River Basin District,2021 to 2027
Expand the flood warning service and engage with communities to encourage sign up in Bromsgrove and Halesowen,Not started - proposed,Preparedness,Management Catchment,2021 to 2027
Expand the flood warning service and engage with communities to encourage sign up in Cheddleton,Not started - proposed,Preparedness,Management Catchment,2021 to 2027
Expand the flood warning service and engage with communities to encourage sign up in Coventry,Not started - proposed,Preparedness,Flood Risk Area,2021 to 2027
"Expand the flood warning service and engage with communities to encourage sign up in Craven Arms, Wyson and Brimfield",Not started - proposed,Preparedness,Management Catchment,2021 to 2027
Expand the flood warning service and engage with communities to encourage sign up in Ellesmere and other locations as identified,Not started - proposed,Preparedness,Management Catchment,2021 to 2027
"Expand the flood warning service and engage with communities to encourage sign up in Kenilworth, Warwick and Tewkesbury
",Not started - proposed,Preparedness,Management Catchment,2021 to 2027
"Expand the flood warning service and engage with communities to encourage sign up in Nailsworth, Stroud, and Lower Tuffley",Not started - proposed,Preparedness,Management Catchment,2021 to 2027
Expand the flood warning service and engage with communities to encourage sign up in Newcastle-under-Lyme and Great Wyrley,Not started - proposed,Preparedness,Management Catchment,2021 to 2027
"Expand the flood warning service and engage with communities to encourage sign up in Shrewsbury, Montford Bridge, Melverley, Llanyblodwel and other communities identified",Not started - proposed,Preparedness,Management Catchment,2021 to 2027
"Expand the flood warning service and engage with communities to encourage sign up in Stoke Prior, Coleford and Ewyas Harold",Not started - proposed,Preparedness,Management Catchment,2021 to 2027
"Expand the flood warning service and engage with communities to encourage sign up in Walsall, Sutton Coldfield and Ashby-de-la-Zouche",Not started - proposed,Preparedness,Management Catchment,2021 to 2027
Expand the flood warning service and engage with communities to encourage sign up in Wolverhampton,Not started - proposed,Preparedness,Flood Risk Area,2021 to 2027
"Expand the flood warning service to areas at risk which are not currently covered, and encourage sign up in Cheltenham",Not started - proposed,Preparedness,Flood Risk Area,2021 to 2027
"Expand the flood warning service to areas at risk which are not currently covered, and encourage sign up in Gloucester",Not started - proposed,Preparedness,Flood Risk Area,2021 to 2027
Exploit opportunities to store water or manage run-off in identified areas in northern England,Ongoing,Protection,River Basin District,2021 to 2027
Exploit opportunities to store water or manage run-off in identified areas in the North West of England,Ongoing,Protection,River Basin District,2021 to 2027
Explore environmental options within future capital schemes in Bradford District,Ongoing,Other,Management Catchment,2027
Explore feasibility of upgrading assets on existing Castleford flood alleviation scheme in Castleford,Ongoing,Protection,Management Catchment,2027
Explore flood risk improvement options which are sustainable and contribute to carbon reductions in Doncaster,Ongoing,Other,Management Catchment,2027
"Explore innovative ways to engage with our workers, residents, visitors and learners in the City",Not started - proposed,Other,Flood Risk Area,2027
"Explore innovative ways to engage with workers, residents, visitors and learners in the borough",Ongoing,Preparedness,Flood Risk Area,2027
"Explore innovative ways to engage with workers, residents, visitors and learners in the borough",Ongoing,Other,Flood Risk Area,2027
"Explore innovative ways to engage with workers, residents, visitors and learners to communicate flood risk and resilience in the borough",Ongoing,Preparedness,Flood Risk Area,2024
Explore integrated solutions to deliver multiple (including environmental and economic) benefits in East Riding,Ongoing,Prevention,Management Catchment,2027
"Explore integrated solutions to deliver multiple benefits for Kirklees to reduce flood risk and look to improve economic, social and environmental benefits in Kirklees",Ongoing,Other,Management Catchment,2027
Explore integrated solutions to deliver multiple benefits in Bradford District,Not started - proposed,Other,Management Catchment,2027
"Explore non-traditional flood risk management schemes which also provide environmental and economic benefits to the local community in Bingley, Shipley and Baildon",Not started - proposed,Other,Flood Risk Area,2027
"Explore opportunities as part of built developments in Gloucestershire including Gloucester, Cheltenham, Tewkesbury, and Stroud",Ongoing,Protection,Management Catchment,2021 to 2027
Explore opportunities for delivering flood risk improvement options in Wakefield District,Ongoing,Protection,Management Catchment,2027
Explore opportunities for verification of Sustainable Drainage Schemes after development in Milton Keynes,Not started - proposed,Prevention,Flood Risk Area,2023
Explore opportunities for working in partnership to support development of the Lincolnshire Coastal Country Park in Chapel St Leonards,Not started - agreed,Protection,Flood Risk Area,2021 to 2027
Explore opportunities for working in partnership to support development of the Lincolnshire Coastal Country Park in Sutton on Sea to Sandilands,Not started - agreed,Protection,Flood Risk Area,2021 to 2027
Explore opportunities for working with nature as part of flood risk improvement works in Wakefield District,Not started - proposed,Other,Management Catchment,2027
Explore opportunities to collaborate with environmental partners and major landowners to increase upland and lowland peat and wetland restoration in northern England,Ongoing,Protection,River Basin District,2027
Explore opportunities to deliver natural flood management works with landowners through a landscape enterprise network model in Northamptonshire,Ongoing,Prevention,River Basin District,2025
Explore opportunities to reconnect rivers and their floodplains and restore natural processes in the Environment Agency Wessex area,Not started - proposed,Prevention,River Basin District,2021 to 2027
Explore opportunities to reconnect rivers and their floodplains in South West England,Not started - proposed,Protection,River Basin District,2021 to 2027
Explore opportunities to work with land owners and managers through the Environment Land Management Scheme in South West England,Not started - proposed,Protection,River Basin District,2021 to 2027
"Explore opportunities to work with stakeholders (including non-governmental organisations), maximising flood risk potential of green infrastructure projects in DCWW wastewater and water catchments",Not started - agreed,Protection,River Basin District,2021 to 2027
Explore opportunities to work with the Environment Land Management Programme in the Environment Agency Wessex and West Midlands Areas,Not started - proposed,Prevention,River Basin District,2021 to 2027
Explore options for flood risk improvement schemes in Hull,Ongoing,Protection,Management Catchment,2027
Explore options for managing surface water flood risk through the development of a sustainable drainage systems strategy/guidance in York District,Ongoing,Protection,Management Catchment,2027
Explore options for surface water flood risk improvement schemes utilising sustainable drainage systems in Hull and Haltemprice,Ongoing,Prevention,Flood Risk Area,2027
"Explore options to attenuate water in Pimperne Brook, Dorset",Not started - proposed,Prevention,Management Catchment,2027
Explore potential funding mechanisms and opportunities in King's Lynn,Not started - proposed,Protection,Flood Risk Area,2024
Explore surface water management improvements in Bradford District,Not started - proposed,Protection,Flood Risk Area,2027
Explore surface water management improvements in Calder Valley,Ongoing,Protection,Management Catchment,2027
Explore the feasibility of delivering a flood alleviation scheme in South Elmsall,Ongoing,Protection,Management Catchment,2027
Extend a scheme of Natural Flood Management measures in the Combe Haven sub-catchment,Not started - proposed,Protection,Flood Risk Area,2021 to 2027
"Extend the Burton upon Trent flood risk management scheme to protect an additional area that flooded in February 2020 in Branston, Burton upon Trent",Not started - proposed,Protection,Flood Risk Area,2021 to 2027
"Extend the flood risk baselining of knowledge, evidence, and carbon assessment in the Lincolnshire and Northamptonshire area",Not started - agreed,Prevention,Strategic Area,2023
Feed into the local plan development process in Essex,Ongoing,Prevention,Flood Risk Area,2021 to 2027
"Finalise the Poole Bridge to Hunger Hill Flood Defence Scheme in Poole Old Town, Poole Harbour",Ongoing,Protection,Management Catchment,2025
Follow national planning policy framework and planning practice guidance on flood risk and coastal change in Ditton,Not started - proposed,Prevention,Flood Risk Area,2021 to 2027
Follow national planning policy framework and planning practice guidance on flood risk and coastal change in East Peckham,Not started - proposed,Prevention,Flood Risk Area,2021 to 2027
Follow national planning policy framework and planning practice guidance on flood risk and coastal change in Five Oak Green,Not started - proposed,Prevention,Flood Risk Area,2021 to 2027
Follow national planning policy framework and planning practice guidance on flood risk and coastal change in London and Thames Estuary,Not started - proposed,Prevention,Flood Risk Area,2021 to 2027
Follow national planning policy framework and planning practice guidance on flood risk and coastal change in Rochester,Not started - proposed,Prevention,Flood Risk Area,2021 to 2027
Follow national planning policy framework and planning practice guidance on flood risk and coastal change in Tonbridge,Not started - proposed,Prevention,Flood Risk Area,2021 to 2027
Follow national planning policy framework and planning practice guidance on flood risk and coastal change in Yalding,Not started - proposed,Prevention,Flood Risk Area,2021 to 2027
"Form next generation strategic working partnerships to attract funding and deliver projects in Stoke-on-Trent

",Not started - proposed,Protection,Management Catchment,2021 to 2023
Further develop options and opportunities to implement nature based solutions in the upper catchment in Calder Valley,Ongoing construction,Other,Management Catchment,2027
Have a clear understanding and record of flood risk asset ownership in King's Lynn,Not started - proposed,Protection,Flood Risk Area,2025
Have adopted a Riverside Strategy which will drive forward the requirements in the Thames Estuary 2100 Plan,Not started - proposed,Protection,Flood Risk Area,2024
Have adopted new flood risk and urban greening policies in the City Plan 2036,Ongoing,Preparedness,Flood Risk Area,2024
Have assessed an appropriate management plan for the operation and maintenance of Vitbe Sluice gates in the river Cray,Not started - agreed,Protection,Flood Risk Area,2027
Have carried out an awareness campaign for properties within flood alert/warning areas in Great Yarmouth,Not started - proposed,Preparedness,Flood Risk Area,2024
"Have collated guidance specific to retrofitting flood resistance and resilience measures to commercial buildings in City of London (including those in Farringdon Street, Pauls Walk and Victoria Embankment)",Ongoing,Protection,Flood Risk Area,2023
Have completed embankment raising on the Ouse Washes as part of the Section 10 works in the River Great Ouse Catchment,Ongoing construction,Protection,River Basin District,2027
Have completed the modelling phase to deliver updated flood zones and inundation mapping in the Thames Estuary,Not started - agreed,Prevention,Flood Risk Area,2027
Have continued its role as a statutory consultee to the local planning authority in Luton,Ongoing,Prevention,Flood Risk Area,2027
"Have continued to maintain a register of flood defence assets, including information of their condition where appropriate in City of London",Ongoing,Preparedness,Flood Risk Area,2026
Have continued to monitor and liaise with key partners around development in the Counters Creek Catchment,Not started - proposed,Recovery and Review,Flood Risk Area,2027
Have continued to progress the delivery of the proposed flood risk management improvements in Herringthorpe,Not started - proposed,Protection,Management Catchment,2027
Have continued to progress the delivery of the proposed flood risk management improvements on A633/A6123 Highways Resilience Works in Parkgate,Not started - agreed,Protection,Management Catchment,2027
Have continued to progress the delivery of the proposed flood risk management improvements on Bramley Brook Flood Alleviation Scheme in Bramley,Not started - proposed,Protection,Management Catchment,2027
Have continued to progress the delivery of the proposed flood risk management improvements on Brookhouse Dike Flood Alleviation Scheme in Brookhouse,Not started - proposed,Protection,Management Catchment,2027
Have continued to progress the delivery of the proposed flood risk management improvements on Broom & Clifton Flood Alleviation Scheme in Broom and Clifton,Not started - proposed,Protection,Management Catchment,2027
Have continued to progress the delivery of the proposed flood risk management improvements on Catcliffe Pumping Station in Catcliffe,Not started - proposed,Protection,Management Catchment,2027
Have continued to progress the delivery of the proposed flood risk management improvements on Eel Mires Dike Flood Alleviation Scheme in Laughton Common,Not started - proposed,Protection,Management Catchment,2027
Have continued to progress the delivery of the proposed flood risk management improvements on Kilnhurst Flood Alleviation Scheme in Kilnhurst,Not started - proposed,Protection,Management Catchment,2027
Have continued to progress the delivery of the proposed flood risk management improvements on Maltby Surface Water Flood Alleviation Scheme in Maltby,Not started - proposed,Protection,Management Catchment,2027
Have continued to progress the delivery of the proposed flood risk management improvements on Parkgate and Rawmarsh Flood Alleviation Scheme in Parkgate,Not started - agreed,Protection,Management Catchment,2027
Have continued to progress the delivery of the proposed flood risk management improvements on Rotherham Culvert Renewal Programme in Rotherham,Not started - proposed,Protection,Management Catchment,2027
Have continued to progress the delivery of the proposed flood risk management improvements on Rotherham Renaissance Flood Alleviation Scheme in Rotherham,Ongoing construction,Protection,Management Catchment,2027
Have continued to progress the delivery of the proposed flood risk management improvements on Swinton Flood Alleviation Scheme in Swinton,Not started - proposed,Protection,Management Catchment,2027
Have continued to progress the delivery of the proposed flood risk management improvements on Todwick Flood Alleviation Scheme in Todwick,Not started - proposed,Protection,Management Catchment,2027
Have continued to progress the delivery of the proposed flood risk management improvements on Whiston Flood Alleviation Scheme in Whiston,Not started - proposed,Protection,Management Catchment,2027
Have continued to progress the delivery of the proposed flood risk management improvements on Woodsetts Flood Alleviation Scheme in Woodsetts,Not started - proposed,Protection,Management Catchment,2027
Have designed and worked to extend a raised defence along the River Plym Estuary in Laira,Ongoing,Protection,Flood Risk Area,2024
"Have developed a joint planning policy to have better agreed principles of flood risk management for new proposed developments in the City of Wolverhampton Council, Walsall Metropolitan Borough Council, Dudley Metropolitan Borough Council and Sandwell Metropolitan Borough Council areas",Ongoing,Prevention,Flood Risk Area,2022
Have developed a surface water flood risk action plan in the borough,Ongoing,Prevention,Flood Risk Area,2025
Have developed a surface water flood risk action plan in the borough,Ongoing,Preparedness,Flood Risk Area,2027
Have developed an evidence database to inform the long term strategic vision and adaptive delivery plan in Dunstable,Ongoing,Prevention,Flood Risk Area,2027
Have developed detailed local flood risk planning guidance in Great Yarmouth,Not started - proposed,Prevention,Flood Risk Area,2026
"Have engaged local community, business and environmental groups to deliver a Flood Risk Management Scheme in Penketh",Ongoing,Protection,Flood Risk Area,2022
Have engaged the local community in investigating alternative flood risk management approaches and habitat creation opportunities in Moss Side,Not started - proposed,Protection,Flood Risk Area,2027
