Description,Status,Type,Scale,Timetable
"Work collaboratively to plan, prioritise and deliver co-ordinated maintenance of new and existing assets in northern England",Not started - proposed,Prevention,River Basin District,2021 to 2027
"Work collaboratively to plan, prioritise and deliver co-ordinated maintenance of new and existing assets in the North West of England",Not started - proposed,Prevention,River Basin District,2021 to 2027
Work collaboratively with the Environment Agency on reducing coastal erosion and flood risk along the shoreline in the Harbour View to Cador Drive and Fareham Quays areas,Not started - proposed,Protection,Flood Risk Area,2021 to 2027
Work in close partnership with Thatcham Flood Forum to disseminate data and information on flood risk to communities in Newbury and Thatcham,Ongoing,Preparedness,Flood Risk Area,2021 to 2027
Work in collaboration with Yorkshire Water Services and other key partners in Leeds,Ongoing,Protection,Flood Risk Area,2027
Work in collaboration with key partners to progress and develop options for Dewsbury and Batley to reduce the risk of flooding in Dewsbury & Batley,Ongoing,Protection,Management Catchment,2027
Work in collaboration with key partners to progress and develop options for Huddersfield and surrounding areas to reduce the risk of river flooding in Huddersfield,Ongoing,Protection,Flood Risk Area,2027
Work in collaboration with key partners to progress and develop options for Mirfield and Ravensthorpe to reduce the risk of flooding in Kirklees,Ongoing,Protection,Flood Risk Area,2027
Work in collaboration with key partners to progress and develop options for Spen to reduce the risk of flooding in Spen,Ongoing,Protection,Management Catchment,2027
"Work in collaboration with key partners to progress and develop options in Bingley, Shipley and Baildon",Not started - proposed,Protection,Flood Risk Area,2027
Work in collaboration with key partners to progress and develop options in Worth Valley and its tributaries in Bradford District,Not started - proposed,Protection,Management Catchment,2027
Work in collaboration with key partners to progress and develop options on the River Aire in Bradford District,Not started - proposed,Protection,Management Catchment,2027
Work in collaboration with key partners to progress and develop options on the River Wharfe in Bradford District,Not started - proposed,Protection,Management Catchment,2027
Work in collaboration with key partners to progress and develop options to manage flood risk and adapt to climate change in East Riding,Ongoing,Protection,Management Catchment,2027
Work in partnership and advise developers concerning flood risk to and from the proposed development of essential infrastructure in Long Eaton,Ongoing,Prevention,Flood Risk Area,2021 to 2027
Work in partnership in Blackburn with Darwen,Not started - proposed,Prevention,Flood Risk Area,2022
Work in partnership in March,Ongoing,Prevention,Flood Risk Area,2021 to 2027
Work in partnership including with Hampshire County Council to commission an update to the hydraulic model in Blackwater catchment (Aldershot to Swallowfield),Ongoing,Prevention,Flood Risk Area,2021 to 2027
Work in partnership including with Hampshire County Council to progress appraisal of preferred options of North Yateley flood alleviation scheme in North Yateley,Ongoing,Protection,Flood Risk Area,2021 to 2027
Work in partnership including with Thames Flood Advisors to support all lead local flood authorities to apply for Government funding in Thames River Basin District,Ongoing,Prevention,River Basin District,2021 to 2027
Work in partnership including with the Environment Agency to monitor the implementation of the Ox Cam Property Flood Resilience Pathfinder,Ongoing,Prevention,Strategic Area,2021 to 2027
Work in partnership to consider a whole catchment approach to progress delivery of the aims and objectives of the Steeping Catchment Action Plan in the Steeping catchment,Not started - proposed,Protection,Strategic Area,2021 to 2027
Work in partnership to continue maintenance of designated flood assets and carry out some environmental enhancements in Cove Brook Flood Storage Area (FSA),Ongoing,Protection,Flood Risk Area,2021 to 2027
Work in partnership to deliver a surface water separation project to provide operational and capacity improvements in the combined sewerage system in Lipson Vale and Laira,Ongoing,Protection,Flood Risk Area,2027
"Work in partnership to deliver the ongoing programme of coastal studies in Devon, Cornwall and the Isles of Scilly",Ongoing,Prevention,River Basin District,2027
Work in partnership to deliver the tidal defence scheme in Christchurch Harbour,Not started - proposed,Protection,Management Catchment,2028
Work in partnership to deliver updates to the Surface Water Management Plan and associated surface water flood risk modelling in the Southport flood risk areas,Not started - proposed,Prevention,Flood Risk Area,2025
Work in partnership to demonstrate the wider benefits of nature inclusive engineering as a coastal management approach in Mounts Bay,Not started - proposed,Protection,Flood Risk Area,2027
"Work in partnership to develop a Tamar Estuary Strategy that links long term tidal defences, wetland and coastal SSSI habitat and development in the River Tamar Catchment",Ongoing,Prevention,Flood Risk Area,2027
Work in partnership to develop a catchment-scale approach which will complement local place based flood risk schemes in non-tidal River Thames catchment (Thames Valley),Not started - agreed,Prevention,River Basin District,2021 to 2027
Work in partnership to develop a community flood resilience plan in Mawgan Porth,Not started - agreed,Prevention,Management Catchment,2021 to 2027
Work in partnership to develop a community flood resilience plan in Perranporth,Not started - agreed,Prevention,Management Catchment,2021 to 2027
Work in partnership to develop a strategy to manage the risk of flooding from rivers and the sea in Truro,Not started - proposed,Prevention,Management Catchment,2024
Work in partnership to develop an integrated water management plan in Chesham,Not started - proposed,Protection,Flood Risk Area,2021 to 2027
"Work in partnership to develop coastal schemes to better protect communities in Cleethorpes and Humberston,",Ongoing,Protection,Flood Risk Area,2021 to 2027
Work in partnership to develop projects to support an Adaptive Approach based on recommendations in the Mounts Bay Strategy in Longrock,Not started - proposed,Protection,Flood Risk Area,2027
Work in partnership to engage with the community through the Mounts Bay Strategy and related projects in Mounts Bay,Not started - proposed,Preparedness,Flood Risk Area,2027
"Work in partnership to enhance the environment and implement natural flood management, improve infrastructure and increase community resilience in Lostwithiel",Not started - proposed,Prevention,Management Catchment,2021 to 2027
Work in partnership to finalise the approvals needed and begin construction on a flood alleviation scheme in Oxford,Ongoing,Protection,Flood Risk Area,2021 to 2027
Work in partnership to identify technically and economically viable options in Esher and Molesey,Ongoing,Protection,Flood Risk Area,2021 to 2027
Work in partnership to identify technically and economically viable options in Hersham,Ongoing,Prevention,Flood Risk Area,2021 to 2027
Work in partnership to implement the Beach and Dune Management Plan in Marazion,Not started - proposed,Protection,Flood Risk Area,2027
Work in partnership to implement the Green Minds Policy and assess opportunities to align surface water storage and green landscapes in Plymouth,Not started - proposed,Prevention,Flood Risk Area,2024
Work in partnership to improve the uptake of flood warning services and improve community resilience mechanisms in the Southport Flood Risk Area,Not started - proposed,Preparedness,Flood Risk Area,2027
Work in partnership to investigate any opportunities to fund and deliver a set of interventions in Penzance,Ongoing,Protection,Flood Risk Area,2027
Work in partnership to investigate opportunities along the River Loddon including in Lower Earley,Ongoing,Protection,Flood Risk Area,2021 to 2027
Work in partnership to investigate opportunities for natural flood management in advance of the Environment Land Management Scheme roll-out in Yateley,Not started - proposed,Protection,Flood Risk Area,2021 to 2027
"Work in partnership to investigate opportunities including transforming existing infrastructure in Byfleet and Weybridge, downstream of the Sanway-Byfleet flood alleviation scheme",Not started - agreed,Prevention,Flood Risk Area,2021 to 2027
Work in partnership to investigate options for more effective asset management and ownership as well as opportunities to deliver flood resilience improvements in East Riding,Not started - proposed,Other,Flood Risk Area,2027
Work in partnership to investigate options for more effective asset management and ownership as well as opportunities to deliver flood resilience improvements in Gilberdyke,Ongoing,Prevention,Flood Risk Area,2027
Work in partnership to investigate options for more effective asset management and ownership as well as opportunities to deliver flood resilience improvements in Hedon,Ongoing,Prevention,Flood Risk Area,2027
Work in partnership to investigate options for more effective asset management and ownership as well as opportunities to deliver flood resilience improvements in Hessle,Ongoing,Prevention,Flood Risk Area,2027
Work in partnership to investigate options for more effective asset management and ownership as well as opportunities to deliver flood resilience improvements in Thorngumbald,Not started - proposed,Other,Flood Risk Area,2027
Work in partnership to investigate options to improve the resilience and user safety of key transport infrastructure at the ferry terminal in Devonport,Not started - proposed,Protection,Flood Risk Area,2027
Work in partnership to investigate the feasibility of flood alleviation options,Not started - proposed,Protection,Flood Risk Area,2021 to 2027
Work in partnership to progress options and build a flood alleviation scheme,Ongoing,Protection,Flood Risk Area,2021 to 2024
"Work in partnership to progress recommendations from the Surface Water Management Plan level 2 study, in the Formby Area",Not started - proposed,Prevention,Flood Risk Area,2023
Work in partnership to provide evidence and advice in Oxford to Cambridge Arc,Ongoing,Prevention,Strategic Area,2021 to 2027
Work in partnership to review flood risk assets and the flood warning service in the Hayle catchment to identify options to deliver an adaptation pathway in St Erth,Ongoing,Prevention,Management Catchment,2021 to 2027
Work in partnership to store and manage surface water in Green Areas in Central Park and Stonehouse and improve the combined sewerage system in Millbridge,Not started - agreed,Protection,Flood Risk Area,2023
Work in partnership to support delivery of the Cornwall Council Climate Change Development Plan Document in Mounts Bay,Not started - proposed,Prevention,Flood Risk Area,2027
Work in partnership to support sustainable growth under the Defra approved Isle of Axholme Flood Risk Management Strategy in Dunscroft,Not started - proposed,Prevention,Flood Risk Area,2021 to 2027
Work in partnership to support the development of an Integrated Water Management plan in the Great Ouse catchment,Ongoing,Prevention,Strategic Area,2021 to 2027
Work in partnership to support the development on an Integrated Water Management plan in Oxford to Cambridge Arc,Ongoing,Prevention,Strategic Area,2021 to 2027
Work in partnership to trial innovative coastal protection in Newlyn,Not started - agreed,Other,Flood Risk Area,2027
Work in partnership to use and reference Plymouth City Council's local plans and Climate Emergency Policy in Plymouth,Not started - proposed,Prevention,Flood Risk Area,2024
Work in partnership with Anglian Water and Harborough District Council to complete the Surface Water Management Plan in Market Harborough,Ongoing,Prevention,Flood Risk Area,2021 to 2027
Work in partnership with Anglian Water and the Environment Agency in Grimsby,Not started - proposed,Prevention,Flood Risk Area,2021 to 2027
Work in partnership with Anglian Water in Thurrock,Not started - proposed,Prevention,Flood Risk Area,2021 to 2027
"Work in partnership with Anglian Water, Internal Drainage Board and the Environment Agency in Immingham",Not started - proposed,Prevention,Flood Risk Area,2021 to 2027
"Work in partnership with Cambridgeshire County Council to investigate opportunities for attenuation (which may include natural flood management) in Beck Brook, Bar Hill Brook and Cottenham Lode",Not started - proposed,Protection,Management Catchment,2027
Work in partnership with Cornwall Council to create a strategy in Mounts Bay,Ongoing,Prevention,Flood Risk Area,2022
"Work in partnership with Essex County Council, Suffolk County Council, Thurrock Council, and Southend-on-Sea Borough Council in the Combined Essex management catchment",Not started - proposed,Protection,Management Catchment,2021 to 2027
Work in partnership with Highways England to assess opportunities in St Neots,Ongoing,Protection,Management Catchment,2021 to 2027
Work in partnership with Surrey County Council to review the Flood Alleviation Scheme options and appraisal report (2019) in Redhill,Ongoing,Protection,Flood Risk Area,2021 to 2027
Work in partnership with Thames Water Utilities Limited and the Environment Agency to progress a Flood Alleviation Scheme,Not started - proposed,Protection,Flood Risk Area,2021 to 2027
Work in partnership with local planning authorities to support the implementation of the updated Hampshire Flood and Water Management Strategy in Farnborough,Ongoing,Prevention,Flood Risk Area,2027
"Work in partnership with organisations and across sectors, sharing skills, knowledge and resources",Not started - proposed,Prevention,Flood Risk Area,2021 to 2027
"Work in partnership with other Risk Management Authorities and consider previous flood events, prefeasibility studies and flood risk investigations in the Great Ouse catchment",Not started - proposed,Prevention,River Basin District,2025
Work in partnership with other Risk Management Authorities and develop design guides for each Development Corporation Area in the Great Ouse catchment,Not started - proposed,Prevention,Strategic Area,2025
Work in partnership with other Risk Management Authorities in King's Lynn,Not started - proposed,Protection,Flood Risk Area,2027
Work in partnership with other Risk Management Authorities to develop a set of medium term tactical plans in the Fens and Lowlands,Not started - agreed,Protection,Strategic Area,2025
Work in partnership with other Risk Management Authorities to establish a network of river wardens in known flood risk hotspots in the Bedford Ouse catchment,Not started - proposed,Preparedness,Management Catchment,2027
Work in partnership with other Risk Management Authorities to implement the recovery cell recommendations following the December 2020 flooding in East Anglia,Not started - proposed,Recovery and Review,River Basin District,2022 to 2027
Work in partnership with other Risk Management Authorities to lead a flood warning exercise in communities with a flood group in the River Great Ouse catchment,Not started - proposed,Preparedness,River Basin District,2021 to 2025
"Work in partnership with other Risk Management Authorities to lead a physical exercise of the property level resilience measures installed in Gough Way, Cambridge",Not started - proposed,Preparedness,Management Catchment,2023
"Work in partnership with other Risk Management Authorities, subject to a successful funding bid through the Innovative Resilience Fund, in the Great Ouse catchment",Not started - proposed,Prevention,Strategic Area,2025
Work in partnership with other organisations to continue to progress the Ouse Washes habitat creation project in the Great Ouse Fens,Not started - proposed,Protection,Strategic Area,2021 to 2027
Work in partnership with other organisations to review the Water Level Management Plan in the Ouse Washes,Not started - agreed,Prevention,Strategic Area,2025
Work in partnership with other risk management authorities to reduce the risk of flooding from all sources in their area,Ongoing,Prevention,National,2021 to 2027
Work in partnership with other risk management authorities to support proactive development of strategic environmental plans in Thames River Basin District,Ongoing,Prevention,River Basin District,2021 to 2027
Work in partnership with other risk management authorities to support the implementation of the Thames Regional Flood and Coastal Committee 25 year vision in Thames River Basin District,Ongoing,Prevention,River Basin District,2021 to 2027
Work in partnership with planning authorities to create local standing advice in central Lincolnshire,Not started - proposed,Preparedness,Flood Risk Area,2021 to 2027
Work in partnership with relevant authorities and support the community to develop an Adaptation Plan in St Blazey and Par,Not started - proposed,Prevention,Flood Risk Area,2027
"Work in partnership with relevant risk management authorities to continue to assess the sustainability of coastal assets and investigate options to adapt frontages and realise wider benefits of nature based solutions in Devon, Cornwall and the Isles of Scilly",Ongoing,Protection,River Basin District,2027
"Work in partnership with relevant risk management authorities to continue to assess the sustainability of harbours as flood risk assets and investigate options to adapt frontages in Devon, Cornwall and the Isles of Scilly",Not started - proposed,Prevention,River Basin District,2027
Work in partnership with risk management authorities and other organisation to explore flood risk improvement options that also have environment and socio economic benefits in Hull,Ongoing,Protection,Management Catchment,2027
Work in partnership with risk management authorities and other organisation to explore flood risk improvement options that also have environment and socio economic benefits in North Yorkshire,Not started - proposed,Other,Management Catchment,2027
Work in partnership with risk management authorities to address flood risk in Lundwood and Low Valley in Barnsley,Ongoing,Other,Management Catchment,2027
Work in partnership with risk management authorities to realise wider benefits of nature-based solutions within flood schemes in Plymouth,Not started - proposed,Protection,Flood Risk Area,2027
Work in partnership with the Borough Council of King's Lynn & West Norfolk and King's Lynn IDB to investigate and consider options in King's Lynn,Not started - proposed,Protection,Flood Risk Area,2021 to 2025
Work in partnership with the Coastal Protection Authority to undertake monitoring and necessary refurbishment of coastal defence assets in Cleethorpes,Not started - proposed,Protection,Flood Risk Area,2021 to 2027
Work in partnership with the East West Rail company and other relevant partners to assess opportunities in the Great Ouse Catchment,Ongoing,Protection,River Basin District,2021 to 2027
Work in partnership with the Environment Agency and Anglian Water in Stanford le hope,Not started - proposed,Protection,Flood Risk Area,2021 to 2027
Work in partnership with the Environment Agency in Cleethorpes,Not started - proposed,Protection,Flood Risk Area,2021 to 2027
Work in partnership with the Environment Agency to progress appraisal of options for Salt Hill Stream Flood Alleviation Scheme in Slough,Not started - agreed,Protection,Flood Risk Area,2021 to 2027
Work in partnership with the Environment Agency to progress the Humberston Fitties flood defence scheme in Humberston and Cleethorpes,Not started - agreed,Protection,Flood Risk Area,2021 to 2027
"Work in partnership with the Environment Agency to restore river corridors, de-culvert and assess removal of structures where appropriate in Slough",Not started - agreed,Preparedness,Flood Risk Area,2021 to 2027
"Work in partnership with the Environment Agency, residents, developers and area stakeholders at Durnford Street in Stonehouse",Not started - agreed,Protection,Flood Risk Area,2024
Work in partnership with the RSPB to implement nature based solutions that will provide opportunities to attenuate water on grazing marshes in the East Suffolk Management Catchment,Not started - proposed,Protection,Management Catchment,2021 to 2027
Work in partnership with the community and the Local Planning Authority to influence Neighbourhood Development Planning in Penzance and Longrock,Not started - proposed,Prevention,Flood Risk Area,2027
Work in partnership with the community and the Local Planning Authority to influence Neighbourhood Development Planning in St Blazey and Par,Not started - proposed,Prevention,Flood Risk Area,2027
Work in partnership with the community to better understand the current and long term coastal and fluvial flood risks in Portreath,Not started - proposed,Preparedness,Flood Risk Area,2027
Work in partnership with the local community and stakeholders to raise the level of flood risk awareness in communities in Plymouth,Not started - proposed,Preparedness,Flood Risk Area,2024
Work in unison to map opportunity catchments for habitat creation and develop a programme for joint delivery in northern England,Ongoing,Protection,River Basin District,2026
Work in unison to map opportunity catchments for habitat creation and develop a programme for joint delivery in the North West of England,Not started - proposed,Protection,River Basin District,2026
Work locally to improve community resilience across the borough in Rotherham,Ongoing,Protection,Management Catchment,2027
"Work proactively with partner organisations to identify opportunities, develop and if possible deliver joint water management infrastructure in the Environment Agency West Midlands Area",Ongoing,Protection,River Basin District,2027
Work to ensure that and Flood and Coastal Erosion Risk Management works undertaken will not be detrimental to the wider policy unit area in the Southport flood risk areas,Not started - proposed,Protection,Flood Risk Area,2027
"Work to identify, develop and progress with landowners, feasible and effective, opportunities for in the River Ribble",Not started - proposed,Protection,Flood Risk Area,2021 to 2027
Work to understand the contribution that the Great Fen Vision could make in the Fens,Ongoing,Protection,Strategic Area,2021 to 2027
Work together at places and communities that will be exposed to significantly increased flood risk as a result of climate change in the North West of England,Not started - proposed,Prevention,River Basin District,2021 to 2027
Work together in response to their declared 'Climate Emergency' statements to generate enforceable local policies and guidance for developments in the Liverpool area,Not started - proposed,Prevention,Flood Risk Area,2027
"Work together to align objectives for Flood Risk, River Basin and Drainage and Wastewater Management Plans up to 2030 in northern England",Not started - proposed,Prevention,River Basin District,2024
"Work together to align objectives for Flood Risk, River Basin and Drainage and Wastewater Management Plans up to 2030 in the North West of England",Not started - proposed,Prevention,River Basin District,2024
"Work together to align strategic objectives in the Flood Risk, River Basin and Drainage and Wastewater Management Plans in North East of England",Not started - agreed,Other,River Basin District,2021 to 2027
"Work together to assess and agree the model/s to be used that best represent/s current and future level of flood risk  in Stroud

",Not started - proposed,Prevention,Management Catchment,2021 to 2027
Work together to better understand and manage the sewerage and drainage system in the Fulwood and Woodplumpton areas,Not started - proposed,Protection,Flood Risk Area,2021 to 2027
Work together to carry out flood modelling to scope options for flood alleviation projects and natural flood management options in the Rise Park Critical Drainage Area,Ongoing,Prevention,Flood Risk Area,2027
Work together to consider Sustainable Drainage Systems solutions as an appropriate mitigative measure in areas compromised by both flood risk and pre-existing contaminated ground in and around Rawtenstall,Not started - proposed,Protection,Flood Risk Area,2027
Work together to consider implications of revised climate change predictions and guidance and changes to other technical understandings in the Lower Alt Catchment,Not started - proposed,Prevention,Flood Risk Area,2025 to 2027
"Work together to deliver conventional, innovative and nature-based improvements to flood risk, water and habitat quality in northern England",Not started - proposed,Protection,River Basin District,2025
"Work together to deliver conventional, innovative and nature-based improvements to flood risk, water and habitat quality in the North West of England",Not started - proposed,Protection,River Basin District,2025
"Work together to develop a Resilience Hub in Devon, Cornwall and the Isles of Scilly",Not started - proposed,Preparedness,River Basin District,2024
Work together to develop a pilot in and around the area,Ongoing,Protection,Flood Risk Area,2024
Work together to develop and implement collaborative strategic plans in the Anglian River Basin District,Not started - proposed,Protection,River Basin District,2021 to 2027
Work together to develop approaches to improve collective learning in North East of England,Ongoing,Preparedness,River Basin District,2027
